{
  "run_id": "run_20260816_102704",
  "capability": "open_sub_account",
  "capability_version": "1.0.0",
  "mode": "replay",
  "inputs": {
    "member_number": "23456",
    "account_type": "Holiday Club",
    "account_nickname": "Vacation fund",
    "initial_deposit": "150.00"
  },
  "started_at": "2026-08-16T14:27:05Z",
  "ended_at": "2026-08-16T14:27:08Z",
  "steps_completed": 11,
  "steps_total": 13,
  "llm_call_count": 0,
  "evidence_path": "evidence/10_replay_gate_irreversible_step/",
  "app_fingerprint_observed": "legacy-cu-portal@4.3.0",
  "status": "NEEDS_INTERVENTION",
  "payload": {
    "reason": "IRREVERSIBLE_STEP",
    "detail": "Step 12 (click) is irreversible and always requires explicit human confirmation.",
    "paused_at_step": 12,
    "screenshot": "evidence/10_replay_gate_irreversible_step/screenshots/intervention_step12.png",
    "session_id": "browser_sess_14db4e58990",
    "requested_action": "Approve here and the automation performs this step, or abandon the run.",
    "control": "HUMAN"
  }
}
